,Movie Name,Eng Name,Country,Time Line,Opening Date,Naver Star,Director,R rated,Actors
0,그린 북,Green Book,미국,130분,2019.01.09 개봉,9.6,피터 패럴리,12세 관람가,"비고 모텐슨, 마허샬라 알리, 린다 카델리니, 세바스찬 매니스캘코, 디미터 D. 마리노프, nan, nan, nan, nan"
1,가버나움,Capharnaum,"레바논, 프랑스",126분,2019.01.24 개봉,9.59,나딘 라바키,15세 관람가,"자인 알 라피아, 요르다노스 시프로우, 보루와티프 트레저 반콜, 나딘 라바키, 하이타 아이잠, nan, nan, nan, nan"
2,원더,Wonder,미국,113분,"2021.02.11 재개봉,  2017.12.27 개봉",9.53,스티븐 크보스키,전체 관람가,"제이콥 트렘블레이, 줄리아 로버츠, 오웬 윌슨, 이자벨라 비도빅, 노아 주프, nan, nan, nan, nan"
3,아일라,Ayla The Daughter of War,"대한민국, 튀르키예",123분,2018.06.21 개봉,9.52,잔 울카이,15세 관람가,"김설, 이스마일 하지오글루, 세틴 테킨도르, 알리 아타이, 자니 영, nan, nan, nan, nan"
4,당갈,Dangal,인도,161분,2018.04.25 개봉,9.49,니테쉬 티와리,12세 관람가,"아미르 칸, 파티마 사나 셰이크, 산야 말호트라, 사크시 탄와르, 기리시 쿨카니, nan, nan, nan, nan"
5,먼 훗날 우리,Us and Them,중국,120분,,9.48,유약영,<class 'str'>,"정백연, 주동우, 톈좡좡, 쑤샤오밍, 시여비, nan, nan, nan, nan"
6,쇼생크 탈출,The Shawshank Redemption,미국,142분,"2016.02.24 재개봉,  1995.01.28 개봉",9.46,프랭크 다라본트,15세 관람가,"팀 로빈스, 모건 프리먼, 밥 건튼, 윌리암 새들러, 클랜시 브라운, nan, nan, nan, nan"
7,덕구,Stand by me,대한민국,91분,2018.04.05 개봉,9.45,방수인,전체 관람가,"이순재, 정지훈, 장광, 성병숙, 차순배, nan, nan, nan, nan"
8,보헤미안 랩소디,Bohemian Rhapsody,"미국, 영국",134분,2018.10.31 개봉,9.42,브라이언 싱어,12세 관람가,"라미 말렉, 루시 보인턴, 귈림 리, 벤 하디, 조셉 마젤로, nan, nan, nan, nan"
9,포레스트 검프,Forrest Gump,미국,142분,"2016.09.07 재개봉,  1994.10.15 개봉",9.41,로버트 저메키스,12세 관람가,"톰 행크스, 로빈 라이트, 게리 시나이즈, 미켈티 윌리암슨, 샐리 필드, nan, nan, nan, nan"
10,위대한 쇼맨,The Greatest Showman,미국,104분,"2020.05.21 재개봉,  2017.12.20 개봉",9.41,마이클 그레이시,12세 관람가,"휴 잭맨, 잭 에프론, 미셸 윌리엄스, 레베카 퍼거슨, 젠데이아 콜먼, nan, nan, nan, nan"
11,인생은 아름다워,La Vita E Bella,대한민국,122분,2022.09.28 개봉,9.41,로베르토 베니니,12세 관람가,"류승룡, 염정아, 박세완, 옹성우, 심달기, nan, nan, nan, nan"
12,헬프,The Help,미국,146분,2011.11.03 개봉,9.4,테이트 테일러,전체 관람가,"엠마 스톤, 비올라 데이비스, 옥타비아 스펜서, 브라이스 달라스 하워드, 제시카 차스테인, nan, nan, nan, nan"
13,캐스트 어웨이,Cast Away,미국,143분,2001.02.03 개봉,9.4,로버트 저메키스,12세 관람가,"톰 행크스, 헬렌 헌트, 닉 서시, None, None, nan, nan, nan, nan"
14,쉰들러 리스트,Schindlers List,미국,196분,"2019.01.24 재개봉,  1994.03.05 개봉",9.39,스티븐 스필버그,15세 관람가,"리암 니슨, 벤 킹슬리, 랄프 파인즈, 캐롤라인 구덜, 조나단 사갈, nan, nan, nan, nan"
15,죽은 시인의 사회,Dead Poets Society,미국,128분,"2021.04.01 재개봉, 2016.08.17 재개봉,  1990.05.19 개봉",9.38,피터 위어,12세 관람가,"로빈 윌리엄스, 로버트 숀 레오나드, 에단 호크, 조쉬 찰스, 게일 핸슨, nan, nan, nan, nan"
16,히든 피겨스,Hidden Figures,미국,127분,2017.03.23 개봉,9.38,데오도르 멜피,12세 관람가,"타라지 P. 헨슨, 옥타비아 스펜서, 자넬 모네, 케빈 코스트너, 커스틴 던스트, nan, nan, nan, nan"
17,집으로...,The Way Home,대한민국,87분,"2019.09.05 재개봉,  2002.04.05 개봉",9.38,이정향,전체 관람가,"김을분, 유승호, 동효희, 민경훈, 임은경, nan, nan, nan, nan"
18,여인의 향기,Scent Of A Woman,미국,157분,1993.03.20 개봉,9.38,마틴 브레스트,15세 관람가,"알 파치노, 크리스 오도넬, 제임스 레브혼, 가브리엘 앤워, 필립 세이모어 호프만, nan, nan, nan, nan"
19,아이 캔 스피크,i Can Speak,대한민국,119분,2017.09.21 개봉,9.37,김현석,12세 관람가,"나문희, 이제훈, 박철민, 염혜란, 이상희, nan, nan, nan, nan"
20,동주,DongJu The Portrait of A Poet,대한민국,110분,2016.02.17 개봉,9.37,이준익,12세 관람가,"강하늘, 박정민, 김인우, 최홍일, 김정팔, nan, nan, nan, nan"
21,굿바이 마이 프랜드,The Cure,미국,97분,1996.08.05 개봉,9.36,피터 호튼,<class 'str'>,"조셉 마젤로, 브래드 렌프로, 다이애나 스카위드, 브루스 데이비슨, 아나벨라 시오라, nan, nan, nan, nan"
22,굿 윌 헌팅,Good Will Hunting,미국,126분,"2016.08.17 재개봉,  1998.03.21 개봉",9.36,구스 반 산트,15세 관람가,"맷 데이먼, 로빈 윌리엄스, 벤 애플렉, 스텔란 스카스가드, 미니 드라이버, nan, nan, nan, nan"
23,미스 슬로운,Miss Sloane,미국,132분,2017.03.29 개봉,9.36,존 매든,15세 관람가,"제시카 차스테인, 마크 스트롱, 구구 바샤-로, 알리슨 필, 마이클 스털버그, nan, nan, nan, nan"
24,자산어보,The Book of Fish,대한민국,126분,2021.03.31 개봉,9.35,이준익,12세 관람가,"설경구, 변요한, 이정은, 민도희, 차순배, nan, nan, nan, nan"
25,지상의 별처럼,TZP,인도,163분,2012.09.06 개봉,9.35,아미르 칸,전체 관람가,"다실 사페리, 아미르 칸, 비핀 샤르마, 티스카 쵸프라, 타나이 크헤다, nan, nan, nan, nan"
26,아마데우스,Amadeus,미국,180분,"2015.10.29 재개봉,  1985.11.23 개봉",9.35,밀로스 포만,12세 관람가,"톰 헐스, F. 머레이 아브라함, 엘리자베스 베리지, 로이 도트라이스, 크리스틴 에버솔, nan, nan, nan, nan"
27,두 교황,The Two Popes,"미국, 영국, 이탈리아, 아르헨티나",126분,2019.12.11 개봉,9.34,페르난도 메이렐레스,12세 관람가,"안소니 홉킨스, 조나단 프라이스, 후안 미누진, 시드니 콜, None, nan, nan, nan, nan"
28,아이 엠 샘,I Am Sam,미국,132분,2002.10.18 개봉,9.33,제시 넬슨,12세 관람가,"숀 펜, 미셸 파이퍼, 다이앤 위스트, 다코타 패닝, 리차드 쉬프, nan, nan, nan, nan"
29,그대를 사랑합니다,I Love You,대한민국,118분,2011.02.17 개봉,9.33,추창민,15세 관람가,"이순재, 윤소정, 송재호, 김수미, 오달수, nan, nan, nan, nan"
30,빌리 엘리어트,Billy Elliot,"영국, 프랑스",110분,"2017.01.18 재개봉,  2001.02.17 개봉",9.33,스티븐 달드리,12세 관람가,"제이미 벨, 줄리 월터스, 게리 루이스, 제이미 드레이븐, 진 헤이우드, nan, nan, nan, nan"
31,피아니스트,The Pianist,"프랑스, 독일, 폴란드, 영국, 네덜란드",148분,"2015.06.18 재개봉,  2003.01.03 개봉",9.33,로만 폴란스키,12세 관람가,"애드리언 브로디, 토마스 크레취만, 프랭크 핀레이, 모린 립먼, 에밀리아 폭스, nan, nan, nan, nan"
32,시네마 천국,Cinema Paradiso,"프랑스, 이탈리아",124분,"2020.04.22 재개봉, 2013.09.26 재개봉, 1993.11.13 재개봉,  1990.07.07 개봉",9.33,쥬세페 토르나토레,전체 관람가,"마르코 레오나르디, 필립 느와레, 자끄 페렝, 살바토레 카스치오, 브리지트 포시, nan, nan, nan, nan"
33,소원,HOPE,대한민국,122분,2013.10.02 개봉,9.33,이준익,12세 관람가,"설경구, 엄지원, 이레, 김해숙, 김상호, nan, nan, nan, nan"
34,우리들의 일그러진 영웅,Our Twisted Hero,대한민국,119분,1992.08.15 개봉,9.32,박종원,전체 관람가,"홍경인, 고정일, 최민식, 태민영, 이진선, nan, nan, nan, nan"
35,블라인드 사이드,The Blind Side,미국,128분,2010.04.15 개봉,9.32,존 리 행콕,12세 관람가,"산드라 블록, 팀 맥그로, 제이 헤드, 퀸튼 아론, 릴리 콜린스, nan, nan, nan, nan"
36,패왕별희 디 오리지널,Farewell My Concubine,"중국, 홍콩",171분,"2021.03.31 재개봉, 2020.05.01 재개봉, 2017.03.30 재개봉,  1993.12.24 개봉",9.32,천카이거,15세 관람가,"장국영, 공리, 장풍의, 지앙 웬리, 갈우, nan, nan, nan, nan"
37,코러스,Les Choristes,"프랑스, 스위스, 독일",97분,"2010.10.29 재개봉,  2005.03.03 개봉",9.32,크리스토퍼 파라티에,전체 관람가,"제라르 쥐노, 프랑수와 벨레앙, 장 밥티스트 모니에, 자끄 페렝, 카드 므라드, nan, nan, nan, nan"
38,뷰티풀 투모로우,Beautiful Tomorrow,대한민국,68분,2017.10.26 개봉,9.31,장재혁,12세 관람가,"박효신, 정재일, None, None, None, nan, nan, nan, nan"
39,8월의 크리스마스,Christmas In August,대한민국,97분,"2013.11.06 재개봉,  1998.01.24 개봉",9.31,허진호,15세 관람가,"한석규, 심은하, 신구, 오지혜, 이한위, nan, nan, nan, nan"
40,록키,Rocky,미국,120분,"2017.11.29 재개봉,  1977.06.11 개봉",9.31,존 G. 아빌드센,12세 관람가,"실베스터 스탤론, 탈리아 샤이어, 버트 영, 칼 웨더스, 버제스 메러디스, nan, nan, nan, nan"
41,일급 살인,Murder In The First,미국,122분,1995.03.18 개봉,9.3,마크 로코,15세 관람가,"크리스찬 슬레이터, 케빈 베이컨, 게리 올드만, 엠베스 데이비츠, 윌리암 H. 머시, nan, nan, nan, nan"
42,달링,Breathe,영국,118분,2018.04.12 개봉,9.3,앤디 서키스,12세 관람가,"앤드류 가필드, 클레어 포이, 톰 홀랜더, 휴 보네빌, 스테판 망간, nan, nan, nan, nan"
43,시월애,A Love Story,대한민국,94분,2000.09.09 개봉,9.29,이현승,12세 관람가,"이정재, 전지현, 김무생, 조승연, 민윤재, nan, nan, nan, nan"
44,인생,Lifetimes,"중국, 대만",132분,1995.05.27 개봉,9.29,장이머우,15세 관람가,"공리, 갈우, 강무, 곽도, None, nan, nan, nan, nan"
45,허스토리,Herstory,대한민국,121분,2018.06.27 개봉,9.29,민규동,12세 관람가,"김희애, 김해숙, 예수정, 문숙, 이용녀, nan, nan, nan, nan"
46,내 이름은 칸,My Name Is Khan,인도,127분,2011.03.24 개봉,9.29,카란 조하르,12세 관람가,"샤룩 칸, 까졸, 쉐인 하퍼, 크리스토퍼 B. 던칸, 하모니 블로썸, nan, nan, nan, nan"
47,"나, 다니엘 블레이크",Daniel Blake,"영국, 프랑스, 벨기에",100분,2016.12.08 개봉,9.29,켄 로치,12세 관람가,"데이브 존스, 헤일리 스콰이어, 샤론 퍼시, 브리아나 샨, 딜런 맥키어넌, nan, nan, nan, nan"
48,천국의 아이들,The Children Of Heaven,이란,87분,"2017.02.09 재개봉,  2001.03.17 개봉",9.28,마지드 마지디,전체 관람가,"레자 나지, 아미르 파로크 하스미얀, 바하레 세디키, None, None, nan, nan, nan, nan"
49,공동경비구역 JSA,Joint Security Area,대한민국,110분,"2015.10.15 재개봉,  2000.09.09 개봉",9.28,박찬욱,15세 관람가,"이영애, 이병헌, 송강호, 김태우, 신하균, nan, nan, nan, nan"
50,반지의 제왕: 왕의 귀환,The Lord Of The Rings The Return Of The King,"뉴질랜드, 미국",263분,"2021.03.18 재개봉, 2017.01.25 재개봉,  2003.12.17 개봉",9.38,피터 잭슨,12세 관람가,"일라이저 우드, 숀 애스틴, 앤디 서키스, 이안 맥켈런, 리브 타일러, nan, nan, nan, nan"
51,해리 포터와 마법사의 돌,Harry Potter And The Sorcerers Stone,"영국, 미국",152분,"2021.09.15 재개봉, 2018.10.24 재개봉,  2001.12.14 개봉",9.37,크리스 콜럼버스,전체 관람가,"다니엘 래드클리프, 루퍼트 그린트, 엠마 왓슨, 로비 콜트레인, 리처드 해리스, nan, nan, nan, nan"
52,반지의 제왕: 두 개의 탑,The Lord Of The Rings The Two Towers,"뉴질랜드, 미국",235분,"2021.03.18 재개봉, 2017.01.18 재개봉,  2002.12.19 개봉",9.35,피터 잭슨,12세 관람가,"일라이저 우드, 이안 맥켈런, 비고 모텐슨, 리브 타일러, 숀 애스틴, nan, nan, nan, nan"
53,반지의 제왕: 반지 원정대,The Lord Of The Rings The Fellowship Of The Ring,"뉴질랜드, 미국",228분,"2021.03.11 재개봉, 2017.01.11 재개봉,  2001.12.31 개봉",9.3,피터 잭슨,12세 관람가,"일라이저 우드, 이안 맥켈런, 리브 타일러, 비고 모텐슨, 숀 애스틴, nan, nan, nan, nan"
54,천녀유혼,A Chinese Ghost Story,홍콩,98분,"2019.04.04 재개봉, 2015.03.19 재개봉,  1987.12.25 개봉",9.29,정소동,12세 관람가,"장국영, 왕조현, 우마, None, None, nan, nan, nan, nan"
55,가위손,Edward Scissorhands,미국,100분,"2014.05.22 재개봉,  1991.06.29 개봉",9.25,팀 버튼,15세 관람가,"조니 뎁, 위노나 라이더, 다이앤 위스트, 안소니 마이클 홀, 케시 베이커, nan, nan, nan, nan"
56,조 블랙의 사랑,Meet Joe Black,미국,178분,1998.12.19 개봉,9.1,마틴 브레스트,15세 관람가,"브래드 피트, 안소니 홉킨스, 클레어 폴라니, 제이크 웨버, 마샤 게이 하든, nan, nan, nan, nan"
57,캐리비안의 해적 - 블랙 펄의 저주,Pirates Of The Caribbean The Curse Of The Black Pearl,미국,143분,2003.09.05 개봉,9.06,고어 버빈스키,12세 관람가,"조니 뎁, 제프리 러쉬, 올랜도 블룸, 키이라 나이틀리, 잭 데이븐포트, nan, nan, nan, nan"
58,온워드: 단 하루의 기적,Onward,미국,102분,2020.06.17 개봉,9.03,댄 스캔론,전체 관람가,"톰 홀랜드, 크리스 프랫, 줄리아 루이스 드레이퍼스, 옥타비아 스펜서, 앨리 웡, nan, nan, nan, nan"
59,천녀유혼 3,A Chinese Ghost Story III,홍콩,105분,"2015.04.30 재개봉,  1991.08.03 개봉",8.99,정소동,12세 관람가,"왕조현, 양조위, 장학우, 리지, 유조명, nan, nan, nan, nan"
60,벤자민 버튼의 시간은 거꾸로 간다,The Curious Case Of Benjamin Button,미국,166분,"2017.11.16 재개봉,  2009.02.12 개봉",8.95,데이빗 핀처,12세 관람가,"브래드 피트, 케이트 블란쳇, 줄리아 오몬드, 타라지 P. 헨슨, 폰느 A. 챔버스, nan, nan, nan, nan"
61,천녀유혼 2,A Chinese Ghost Story II The Story Continues,홍콩,103분,"2015.04.09 재개봉,  1990.07.14 개봉",8.93,정소동,12세 관람가,"장국영, 왕조현, 우마, 이가흔, 이자웅, nan, nan, nan, nan"
62,캐리비안의 해적 - 망자의 함,Pirates Of The Caribbean Dead Mans Chest,미국,143분,2006.07.06 개봉,8.91,고어 버빈스키,12세 관람가,"조니 뎁, 올랜도 블룸, 키이라 나이틀리, 빌 나이, 스텔란 스카스가드, nan, nan, nan, nan"
63,해리 포터와 비밀의 방,Harry Potter And The Chamber Of Secrets,"영국, 미국",162분,"2019.02.20 재개봉,  2002.12.13 개봉",8.89,크리스 콜럼버스,전체 관람가,"다니엘 래드클리프, 루퍼트 그린트, 엠마 왓슨, 리처드 해리스, 케네스 브래너, nan, nan, nan, nan"
64,팀 버튼의 크리스마스 악몽,Tim Burtons The Nightmare Before Christmas,미국,75분,"2006.12.07 재개봉,  1995.01.14 개봉",8.87,헨리 셀릭,전체 관람가,"대니 엘프만, 크리스 서랜던, 캐서린 오하라, 윌리엄 히키, 글렌 샤딕스, nan, nan, nan, nan"
65,스타더스트,Stardust,"영국, 미국",128분,2007.08.15 개봉,8.81,매튜 본,12세 관람가,"찰리 콕스, 클레어 데인즈, 미셸 파이퍼, 로버트 드 니로, 시에나 밀러, nan, nan, nan, nan"
66,드라큐라,Bram Stokers Dracula,미국,128분,1993.01.16 개봉,8.79,프란시스 포드 코폴라,15세 관람가,"게리 올드만, 위노나 라이더, 안소니 홉킨스, 키아누 리브스, 리차드 E. 그랜트, nan, nan, nan, nan"
67,찰리와 초콜릿 공장,Charlie And The Chocolate Factory,"미국, 영국",114분,2005.09.16 개봉,8.79,팀 버튼,전체 관람가,"조니 뎁, 프레디 하이모어, 데이빗 켈리, 헬레나 본햄 카터, 노아 테일러, nan, nan, nan, nan"
68,미녀와 야수,Beauty and the Beast,미국,85분,"2012.04.11 재개봉,  1992.07.04 개봉",8.78,빌 콘돈,전체 관람가,"페이지 오하라, 로비 벤슨, 리처드 화이트, 제리 오바치, 데이빗 오그던 스타이어스, nan, nan, nan, nan"
69,해리 포터와 아즈카반의 죄수,Harry Potter And The Prisoner Of Azkaban,"미국, 영국",141분,"2021.05.05 재개봉, 2020.02.26 재개봉,  2004.07.16 개봉",8.76,알폰소 쿠아론,전체 관람가,"다니엘 래드클리프, 엠마 왓슨, 루퍼트 그린트, 로비 콜트레인, 티모시 스폴, nan, nan, nan, nan"
70,스트레인저 댄 픽션,Stranger Than Fiction,미국,112분,2007.09.06 개봉,8.72,마크 포스터,12세 관람가,"윌 페렐, 매기 질렌할, 더스틴 호프만, 퀸 라티파, 엠마 톰슨, nan, nan, nan, nan"
71,"당신, 거기 있어줄래요",Will You Be There,대한민국,111분,2016.12.14 개봉,8.72,홍지영,12세 관람가,"김윤석, 변요한, 채서진, 김상호, 안세하, nan, nan, nan, nan"
72,큐브,Cube,캐나다,90분,1999.10.23 개봉,8.71,빈센조 나탈리,청소년 관람불가,"니콜 드 보아, 니키 과다그니, 데이빗 휴렛, 앤드류 밀러, 줄리안 리칭즈, nan, nan, nan, nan"
73,나니아 연대기 - 캐스피언 왕자,The Chronicles Of Narnia Prince Caspian,"영국, 미국",145분,2008.05.15 개봉,8.62,앤드류 애덤슨,전체 관람가,"벤 반스, 조지 헨리, 스캔다 케인즈, 윌리암 모즐리, 안나 팝플웰, nan, nan, nan, nan"
74,천국의 우편배달부,Postman To Heaven,대한민국,107분,2009.11.11 개봉,8.61,이형민,전체 관람가,"김재중, 한효주, 신구, 김창완, 주진모, nan, nan, nan, nan"
75,13층,The Thirteenth Floor,"독일, 미국",98분,1999.11.27 개봉,8.57,조세프 루스낵,12세 관람가,"크레이그 비에코, 그레첸 몰, 빈센트 도노프리오, 데니스 헤이스버트, 스티브 슈브, nan, nan, nan, nan"
76,천년여우 여우비,Yobi,대한민국,85분,2007.01.25 개봉,8.56,이성강,전체 관람가,"손예진, 공형진, 류덕환, 이향숙, 김소형, nan, nan, nan, nan"
77,스파이더위크가의 비밀,The Spiderwick Chronicles,미국,95분,2008.02.14 개봉,8.53,마크 워터스,전체 관람가,"프레디 하이모어, 메리 루이스 파커, 닉 놀테, 사라 볼거, 앤드류 맥카시, nan, nan, nan, nan"
78,록키 호러 픽쳐 쇼,The Rocky Horror Picture Show,"영국, 미국",100분,"2016.10.13 재개봉,  1998.06.20 개봉",8.51,짐 셔먼,청소년 관람불가,"팀 커리, 수잔 서랜든, 베리 보스트윅, 리처드 오브라이언, 패트리시아 퀸, nan, nan, nan, nan"
79,호빗: 다섯 군대 전투,The Hobbit The Battle of the Five Armies,"뉴질랜드, 미국",144분,"2021.12.02 재개봉,  2014.12.17 개봉",8.5,피터 잭슨,12세 관람가,"마틴 프리먼, 이안 맥켈런, 리처드 아미티지, 케이트 블란쳇, 올랜도 블룸, nan, nan, nan, nan"
80,호빗 : 스마우그의 폐허,The Hobbit  The Desolation of Smaug,"미국, 뉴질랜드",161분,"2021.11.24 재개봉,  2013.12.12 개봉",8.48,피터 잭슨,12세 관람가,"마틴 프리먼, 이안 맥켈런, 리처드 아미티지, 케이트 블란쳇, 올랜도 블룸, nan, nan, nan, nan"
81,아더와 미니모이: 제1탄 비밀 원정대의 출정,Arthur Et Les Minimoys,"미국, 프랑스",102분,2009.07.09 개봉,8.48,뤽 베송,전체 관람가,"프레디 하이모어, 미아 패로, 페니 밸포어, 더그 랜드, 아담 르페브리, nan, nan, nan, nan"
82,미스 페레그린과 이상한 아이들의 집,Miss Peregrines Home For Peculiar Children,미국,127분,2016.09.28 개봉,8.45,팀 버튼,12세 관람가,"에바 그린, 에이사 버터필드, 사무엘 L. 잭슨, 앨리슨 제니, 엘라 퍼넬, nan, nan, nan, nan"
83,호빗 : 뜻밖의 여정,The Hobbit An Unexpected Journey,"미국, 뉴질랜드",169분,"2021.11.18 재개봉,  2012.12.13 개봉",8.42,피터 잭슨,12세 관람가,"이안 맥켈런, 마틴 프리먼, 리처드 아미티지, 제임스 네스빗, 켄 스탓, nan, nan, nan, nan"
84,존 말코비치 되기,Being John Malkovich,미국,112분,2000.05.13 개봉,8.41,스파이크 존즈,청소년 관람불가,"존 쿠삭, 카메론 디아즈, 캐서린 키너, 오슨 빈, 메리 케이 플레이스, nan, nan, nan, nan"
85,"오늘 밤, 로맨스 극장에서",Color Me True,일본,109분,2018.07.11 개봉,8.38,타케우치 히데키,전체 관람가,"아야세 하루카, 사카구치 켄타로, 혼다 츠바사, 키타무라 카즈키, 나카오 아키요시, nan, nan, nan, nan"
86,불청객,The Uninvited,대한민국,66분,2010.09.30 개봉,8.33,이응일,12세 관람가,"김진식, 원강영, 이응일, None, None, nan, nan, nan, nan"
87,헝거게임: 캣칭 파이어,The Hunger Games Catching Fire,미국,146분,2013.11.21 개봉,8.31,프란시스 로렌스,15세 관람가,"제니퍼 로렌스, 조쉬 허처슨, 리암 헴스워스, 우디 해럴슨, 샘 클라플린, nan, nan, nan, nan"
88,비밀,Secret,일본,119분,"2014.03.27 재개봉,  2002.10.11 개봉",8.28,타키타 요지로,15세 관람가,"히로스에 료코, 코바야시 카오루, 키시모토 가요코, 카네코 켄, 이시다 유리코, nan, nan, nan, nan"
89,판의 미로 - 오필리아와 세 개의 열쇠,El Laberinto Del Fauno,"미국, 멕시코, 스페인",119분,"2019.05.02 재개봉,  2006.11.30 개봉",8.25,기예르모 델 토로,15세 관람가,"이바나 바쿠에로, 더그 존스, 세르지 로페즈, 아리아드나 길, 마리벨 베르두, nan, nan, nan, nan"
90,내안의 그놈,Inside me,대한민국,122분,2019.01.09 개봉,8.24,강효진,15세 관람가,"진영, 박성웅, 라미란, 이수민, 이준혁, nan, nan, nan, nan"
91,말레피센트,Maleficent,미국,97분,2014.05.29 개봉,8.22,로버트 스트롬버그,12세 관람가,"안젤리나 졸리, 엘르 패닝, 샬토 코플리, 주노 템플, 브렌튼 스웨이츠, nan, nan, nan, nan"
92,캐리비안의 해적 - 세상의 끝에서,Pirates Of The Caribbean At Worlds End,미국,168분,2007.05.23 개봉,8.21,고어 버빈스키,12세 관람가,"조니 뎁, 올랜도 블룸, 키이라 나이틀리, 스텔란 스카스가드, 빌 나이, nan, nan, nan, nan"
93,인랑,JINROH The Wolf Brigade,일본,98분,"2019.09.04 재개봉,  2000.12.01 개봉",8.21,오키우라 히로유키,15세 관람가,"후지키 요시카츠, None, None, None, None, nan, nan, nan, nan"
94,경계선,GRANS,"스웨덴, 덴마크",110분,2019.10.24 개봉,8.21,알리 아바시,청소년 관람불가,"에바 멜란데르, 에로 밀로노프, 요르겐 토르손, 앤 페트렌, 스텐 륜그렌, nan, nan, nan, nan"
95,슬리피 할로우,Sleepy Hollow,미국,111분,2000.01.29 개봉,8.19,팀 버튼,청소년 관람불가,"조니 뎁, 크리스티나 리치, 미란다 리차드슨, 마이클 갬본, 캐스퍼 반 디엔, nan, nan, nan, nan"
96,신비한 동물사전,Fantastic Beasts and Where to Find Them,"영국, 미국",132분,"2022.03.23 재개봉,  2016.11.16 개봉",8.18,데이빗 예이츠,12세 관람가,"에디 레드메인, 콜린 파렐, 캐서린 워터스턴, 앨리슨 수돌, 댄 포글러, nan, nan, nan, nan"
97,메리 포핀스 리턴즈,Mary Poppins Returns,미국,130분,2019.02.14 개봉,8.16,롭 마샬,전체 관람가,"에밀리 블런트, 린-마누엘 미란다, 벤 위쇼, 에밀리 모티머, 줄리 월터스, nan, nan, nan, nan"
98,케이트 앤 레오폴드,Kate  Leopold,미국,118분,2003.10.31 개봉,8.12,제임스 맨골드,12세 관람가,"멕 라이언, 휴 잭맨, 리브 슈라이버, 브레킨 메이어, 나타샤 리온, nan, nan, nan, nan"
99,환생,Resurrection,일본,104분,2003.10.31 개봉,8.1,시오타 아키히코,전체 관람가,"쿠사나기 츠요시, 다케우치 유코, 아이카와 쇼우, 야마모토 케이치, 키타바야시 타니에, nan, nan, nan, nan"
100,뱀파이어와의 인터뷰,Interview With The Vampire The Vampire Chronicles,미국,123분,1994.12.31 개봉,9.12,닐 조던,청소년 관람불가,"톰 크루즈, 브래드 피트, 안토니오 반데라스, 스티븐 레아, 크리스찬 슬레이터, nan, nan, nan, nan"
101,에이리언,Alien,미국,117분,1987.10.01 개봉,9.12,리들리 스콧,15세 관람가,"톰 스커릿, 시고니 위버, 베로니카 카트라이트, 해리 딘 스탠튼, 존 허트, nan, nan, nan, nan"
102,싸이코,Psycho,미국,109분,1962.07.28 개봉,9.1,알프레드 히치콕,청소년 관람불가,"안소니 퍼킨스, 베라 마일즈, 존 게빈, 마틴 발삼, 존 맥킨타이어, nan, nan, nan, nan"
103,죠스,Jaws,미국,124분,1978.04.22 개봉,8.96,스티븐 스필버그,12세 관람가,"로이 샤이더, 로버트 쇼, 리차드 드레이퓨즈, 로레인 게리, 머레이 해밀턴, nan, nan, nan, nan"
104,무서운 집,Scary house,대한민국,98분,"2015.08.08 재개봉,  2015.07.30 개봉",8.91,양병간,12세 관람가,"구윤희, 양병간, None, None, None, nan, nan, nan, nan"
105,사탄의 인형,Childs Play,미국,87분,1991.10.26 개봉,8.85,톰 홀랜드,15세 관람가,"캐서린 힉스, 크리스 서랜던, 알렉스 빈센트, 브래드 듀리프, 디나 마노프, nan, nan, nan, nan"
106,"장화, 홍련",A Tale Of Two Sisters,대한민국,118분,2003.06.13 개봉,8.78,김지운,12세 관람가,"임수정, 염정아, 김갑수, 문근영, 박미현, nan, nan, nan, nan"
107,알 포인트,RPoint,대한민국,106분,2004.08.20 개봉,8.77,공수창,15세 관람가,"감우성, 손병호, 박원상, 오태경, 이선균, nan, nan, nan, nan"
108,블레이드 2,Blade,미국,116분,2002.04.05 개봉,8.75,길예르모 델 토로,청소년 관람불가,"웨슬리 스나입스, 크리스 크리스토퍼슨, 론 펄먼, 레오노어 바레라, 노만 리더스, nan, nan, nan, nan"
